{
    "$schema": "../recipe-schema.json",
    "name": "Passion Rum Cooler",
    "tags": [
        "Fruchtig",
        "Exotisch",
        "Longdrink"
    ],
    "description": "Der Passion Rum Cooler verbindet den tropischen Geschmack von Maracuja mit einem spritzigen Limetouch und dem milden Charakter von Bacardi. Leicht, erfrischend und voller Urlaubsfeeling - ein cooler Sommerdrink, der Lust auf mehr macht.",
    "nominal_serving_volume": 250,
    "steps": [
        {
            "kind": "parallel",
            "steps": [
                {
                    "kind": "dispense",
                    "ingredient": "white_rum",
                    "volume": 40
                },
                {
                    "kind": "dispense",
                    "ingredient": "maracuja_juice",
                    "volume": 110
                }
            ]
        },
        {
            "kind": "dispense",
            "ingredient": "lime_juice",
            "volume": 10
        },
        {
            "kind": "dispense",
            "ingredient": "soda",
            "volume": 60
        },
        {
            "kind": "manual",
            "text": "2 Eiswürfel"
        }
    ]
}
